id	quotation	type	source_1	source_2	translation	notes
636	Consentientes et agentes pari poena plectentur.		Edward Coke		Those who consent to the act, and those who commit it, should be visited with equal punishment.	See Qui facit, &c.
637	Consentire non videtur qui errat.	legal maxim			He who is under a mistake is not considered to consent.	No one, in law, is deemed to consent to that of which he had not a previous knowledge. But every man is supposed to know the law, and "ignorantia legis non excusat." See Nil volitum, &c.
638	Consilia firmiora sunt de divinis locis.		Plautus		Advice is given with higher sanction from holy places.	
639	Consilia qui dant prava cautis hominibus, Et perdunt operam et deridentur turpiter.		Phaedrus		Those who give bad advice to discreet persons, both lose their pains and, to their disgrace, are laughed to scorn.	
640	Consilium Pompeii plane Themistocleum est; putat enim, qui mari potitur, eum rerum potiri.		Cicero		The plan of Pompey is clearly that of Themistocles; for he thinks that he who gains the command of the sea, must obtain the supreme power.	
641	Conspicit arcem, Ingeniis, opibusque, et festa pace virentem.		Ovid		She looks upon the citadel, flourishing in arts, in wealth, and joyous peace.	
642	Constans et lenis, ut res expostulet, esto.		Dionysius Cato		Be firm or mild, as circumstances may require.	
643	Constiterant hinc Thisbe, Pyramus illinc, Inque vicem fuerat captatus anhelitus oris.		Ovid		They took their stations, Thisbe on the one side, and Pyramus on the other, and the breath of their mouths was mutually caught by turns.	
644	Constructio legis non facit injuriam.		Edward Coke		The construction of the law does no injury.	
645	Consuefacere aliquem sua sponte recte facere quam alieno metu.		Terence		To teach a person to act correctly of his own accord, rather than through fear of another.	
646	Consuetudine animus rursus te huc inducet.		Plautus		Through habit your inclination will be leading you to do it again.	
647	Consuetudinem benignitatis, largitioni munerum antepono. Haec est gravium hominum atque magnorum; illa quasi assentatorum populi, multitudinis levitatem voluptate quasi titillantium.		Cicero		I prefer much the habit of courtesy to the bestowing of contributions. The one is in the power of men of eminence and high character; the other belongs to the flatterers of the populace, who in a manner tickle and delight the multitude thereby.	
648	Consuetudo est altera lex.		Edward Coke		Usage is a second law.	
649	Consuetudo est altera natura.		Cicero		Use is second nature.	
650	Consuetudo est optimus interpres legum.		Edward Coke		Custom is the best interpreter of the laws.	
651	Consuetudo pro lege servatur.	legal maxim			Custom is held as law.	Usage from time immemorial is the basis of our common law.
652	Consule de gemmis, de tincta murice lana, Consule de facie corporibusque diem.		Ovid		Consult the daylight about gems, about wool dyed in purple; consult it about the face and the figure as well.	
653	Consummatum est.				It is finished.	
654	Contemni est gravius stultitiae quam percuti.				To a foolish man, it is more bitter to be treated with contempt, than to receive a blow.	
655	Contemni se impatienter ferunt principes, quippe qui coli consueverunt.		Tacitus		Princes, because they have been accustomed to receive homage, can ill brook being treated with contempt.	
656	Contemnuntur ii qui nec sibi, nec alteri prosunt, ut dicitur; in quibus nullus labor, nulla industria, nulla cura est.		Cicero		They are to be despised, who neither profit themselves nor others, as the saying is; in whom there is no exertion, no industry, no thought.	
657	Contemporanea expositio est fortissima in lege.	legal maxim			A contemporary exposition prevails in law.	A precedent drawn from the established practice of the time, when the law was promulgated, being made in accordance with the then prevailing notions and usages, ought to have the most force.
658	Contigimus portum, quo mihi cursus erat.		Ovid		I have reached the harbour, to which I steered my course.	
659	Continuo culpam ferro compesce, priusquam Dira per incautum serpant contagia vulgus.		Virgil		Instantly repress the mischief with the knife, before the dire contagion has infected the unthinking multitude.	Even among civilized nations, we see life sacrificed for the common good.
660	Contra bonos mores.				Contrary to good manners,	or morals.
661	Contra malum mortis, non est medicamen in hortis.	medical aphorism			Against the evil of death there is no remedy in gardens.	A Leonine line.
662	Contra stimulum calcas.		Terence		You kick against the spur.	So in Acts ix. 5, "It is hard for thee to kick against the pricks?" The meaning is, that you only injure yourself by resistance.
663	Contra verbosos noli contendere verbis; Sermo datur cunctis, animi sapientia paucis.		cato		Strive not with words against the contentious; speech is given to all, wisdom to few.	
664	Contumeliam si dices, audies.		Plautus		If you utter affronting speeches, you will have to hear them.	
665	Conveniens vitae mors fuit ista suae.		Ovid		That was a death conformable to his life.	
666	Conventio privatorum non potest publico juri derogare.		Edward Coke		An agreement between private persona cannot derogate from the rights of the public.	
667	Convivae certe tui dicant, Bibamus, moriendum est.		Seneca		Your guests are for saying, no doubt, 'Let us drink, for die we must.'	See 1 Cor. xv. 32.
668	Convivatoris, uti ducis, ingenium res Adversae nudare solent, celare secundae.		Horace		Untoward circumstances usually bring out the talents of a host, as they do those of a general; while everything goes on well, they lie concealed.	
669	Cor ne edito.	proverb			Eat not your heart.	A figurative expression, meaning, "Do not consume your life with cares."
670	Coram domino rege.				Before our lord the king.	
671	Coram nobis.	law latin			Before us.	Before the court. Before persons invested with due authority.
672	Coram non judice.				Before a person who is not a judge.	Before a tribunal which has no jurisdiction.
673	Cornix scorpium rapuit.	proverb			The crow seized a scorpion,	and was stung to death. Mischief recoils on its author. See Neque enim. &c.
674	Coronat virtus cultores suos.				Virtue crowns her votaries.	
675	Corpora lente augescunt, cito extinguuntur.		Tacitus		All bodies are slow in growth, rapid in decay.	
676	Corpora magnanimo satis est prostrasse leoni: Pugna suum finem, cum jacet hostis, habet.		Ovid		It is sufficient for the noble-hearted lion to have brought the body to the ground: the contest is over when the enemy lies prostrate.	The poets give the lion a better character than he really deserves.
677	Corpori tantum indulgeas quantum bonae valetudini satis est.		Seneca		Indulge the body only so far as is necessary for good health.	Be moderate in pleasures although harmless in themselves.
678	Corporis et fortunae bonorum ut initium finis est. Omnia arte occidunt, et aucta senescunt.		Sallust		Of the blessings of health and fortune, as there is a beginning, so there is an end. Everything, as it is improved by art, hurries onward to decay, and increases only to become old.	
679	Corpus adhuc Echo, non vox erat: et tamen usum Garrula non alium, quam nunc habet, oris habebat; reddere de multis ut verba novissima posset.		Ovid		Echo was then a body, not a mere voice; and yet the babbler had no other use of speech than she now has, to be able to repeat the last words out of many.	
680	Corpus delicti.	law phrase			The body of the offence.	The sum and substance of the crime.
681	Corpus omne sive arescit in pulverem, sive in humorem solvitur, vel in cinerem comprimitur, vel in nidorem tenuatur, subducitur nobis; sed Deo elementorum custode reservatur.		Marcus Minucius Felix		(When death happens) every body is reduced to dust, dissolved into fluid, converted to ashes, or wasted away by evaporation, and so withdrawn from our sight; but it is preserved in the hands of God, the guardian of the elements.	
682	Corpus onustum Hesternis vitiis animum quoque praegravat una.		Horace		The body, oppressed by the debauch of yesterday, weighs down the mind as well.	
683	Corpus quasi vas est aut aliquod animi receptaculum.		Cicero		The body is a vessel, as it were, or receptacle for the soul.	
684	Corpus sine pectore.				A body without a soul.	A lump of flesh without spirit or animation. See Sine pectore corpus.
685	Corrumpunt bonos mores colloquia prava.	proverb			Evil communications corrupt good manners.	From the Greek.
686	Corrupti mores sunt depravatique admiratione divitiarum.		Cicero		Manners become corrupted and depraved through the hankering for riches.	
687	Corruptio optimi pessima.				The corruption of the best produces the worst.	Nothing is so pernicious both in example and results as the rebound from very good to very bad. So our old proverb, "The sweetest wine makes the sharpest vinegar."
688	Corruptissima in republica plurimae leges.		Tacitus		In the state which is the most corrupt, the laws are always the most numerous.	Such a state of things necessitates a multiplicity of laws.
689	Cos ingeniorum.				A whetstone for the wits.	
690	Cras credemus, hodie nihil.	proverb			Tomorrow we will believe, not to-day.	Let us wait and see what will happen to-morrow; for the present we will sleep upon it.
691	Credat Judaeus Apella.		Horace		Let Apella the Jew believe it.	An expression used in derision of the Jews, who were held in the greatest contempt among the Romans, every vice or weakness being imputed to them.
692	Crede mihi bene qui latuit, bene vixit, et intra Fortunam debet quisque manere suam.		Ovid		Believe me, he who has the good fortune to escape notice, lives the happiest life, and every one is bound to live within his means.	
693	Crede mihi, miseros prudentia prima relinquit.		Ovid		Believe me, prudence is the first thing to forsake the wretched.	
694	Crede mihi, multos habeas cum dignus amicos, Non fuit e multis quolibet ille minor.		Ovid		Believe me, although you deservedly have many friends, he out of those many was inferior to none.	
695	Crede mihi, res est ingeniosa dare.		Ovid		Believe me, it is a noble thing to give.	
696	Crede quod est quod vis; ac desine tuta vereri; Deque fide certa sit tibi certa fides.		Ovid		Believe that that is, which thou dost wish to be; cease to fear for what is secure, and have a certain assurance of undoubted constancy.	
697	Crede quod habes, et habes.				Believe that you have it, and you have it.	This is not universally true — witness the unhappy termination of Alnaschar's reverie, whose story is told in the Spectator and the Arabian Nights.
698	Credebant hoc grande nefas, et morte piandum, Si juvenis vetulo non assurrexerat.		Juvenal		They used to hold it to be a heinous sin, and one that death alone could expiate, if a young man did not rise to pay honour to an elder.	
699	Credite, posteri!		Horace		Believe it, Posterity!	
700	Credo pudicitiam, Saturno rege, moratam In terris.		Juvenal		In the reign of Saturn I believe that chastity did exist in the world.	The reign of Saturn was the "golden age" of the Romans. Juvenal is speaking of the almost universal corruption of the Roman females in his day.
701	Credula res amor est.		Ovid		Love is a credulous thing.	
702	Credula vitam Spes fovet, ac melius eras fore semper ait.		Tibullus		Credulous hope cherishes life, and ever tells us that to-morrow will be better.	
703	Crescentem sequitur cura pecuniam, Majorumque fames. Multa petentibus, Desunt multa. Bene est cui Deus obtulit Parca quod satis est manu.		Horace		Care attends accumulated wealth, and a thirst for still greater riches. They who require much are always in want of much. Happy is he to whom God has given a sufficiency with a sparing hand.	
704	Crescit amor nummi quantum ipsa pecunia crescit: Et minus hanc optat, qui non habet.		Juvenal		The love of money increases as fast as our wealth, and he who has none wishes for it the least.	
705	Crescit indulgens sibi dirus hydrops.		Horace		The fatal dropsy nursed by self-indulgence increases apace.	This figure is here used in reference to the "greed for gain."
706	Crescit sub pondere virtus.				Virtue grows under every weight;	shines forth with renewed lustre under every trial. The motto of the Earl of Denbigh.
707	Cressa ne careat pulchra dies nota.		Horace		Let not a day so joyful be without its mark of Cretan chalk.	
708	Creta an carbone notandum.		Horace		To be marked with chalk, or with charcoal.	The Romans thus distinguished their lucky and unlucky days.
709	Creta notare.				To mark with chalk.	To place a white line against the name of a person was to signify approval.
710	Cretizandum cum Crete.	proverb			A man must be a Cretan with the Cretans.	We must do at Rome as Rome does.
711	Creverunt et opes, et opum furiosa cupido: Et cum possideant plurima, plura volunt.		Ovid		Both wealth has increased, and the maddening lust for wealth: and though men possess ever so much they still wish for more.	
712	Crimen laesae majestatis.	legal concept			The crime of lese majesty,	which involves the guilt of high-treason.
713	Crimen quod mihi dabatur, crimen non erat.		Cicero		That which was imputed to me as a crime was no crime.	
714	Crimina qui cernunt aliorum, non sua cernunt, Hi sapiunt aliis, desipiuntque sibi.				Those who see the faults of others, do not see their own; such men are wise towards others, and fools to themselves.	
715	Crimine ab uno Disce omnes.		Virgil		From one offence learn all.	
716	Crine ruber, niger ore, brevis pede, lumine laesus: Rem magnam praestas, Zoile, si bonus es.		Martial		With red hair, and tawny features, short of one foot, and blind of an eye — you do wonders, indeed, Zoilus, if you are a good man.	
717	Croesum, quem vox justi facunda Solonis Respicere ad longae jussit spatia ultima vitae.		Juvenal		Croesus, whom the eloquent voice of the righteous Solon bade look upon the closing scene of a long life.	See Herodotus, b. i e. 32.
718	Crudelem medicum intemperans aeger facit.		Publilius Syrus		A disobedient patient makes an unfeeling physician.	Because he is obliged to have recourse to harsher measures to effect a cure.
719	Crudelis ubique Luctus, ubique pavor, et plurima mortis imago.		Virgil		Everywhere is cruel sorrow, terror on every side, and death in a thousand shapes.	
720	Crux.				A cross.	Anything that frets or annoys us, a difficulty or stumblingblock is so called. Thus, crux criticorum, "the cross of critics;" crux medicorum, "the cross of physicians;" crux mathematicorum, "the cross of mathematicians."
721	Cucullus non facit monachum.				The cowl does not make the monk.	Trust not appearances.
722	Cui bono?				For whose benefit?	A maxim of Cassius, the judge, quoted by Cicero (Pro Milone). It is generally used as signifying, "What is the good of it?"
723	Cui famulatur maximus orbis Diva potens rerum, domitrixque pecunia fati.				She to whom the great world is obedient, that goddess who rules mankind, money, the controller of fate.	
724	Cui licet quod majus, non debet quod minus est non licere.	legal maxim			He who has the greater right, ought not to be without the lesser one.	Thus, in the transfer of property, a conveyance of the rights incident to it is always to be presumed.
725	Cui malo?				To what evil?	What harm can result from it?
726	Cui mens divinior atque os Magna sonaturum des nominis hujus honorem.		Horace		To him who is divinely inspired, and has a command of lofty language, you may grant the honour of this title.	Said in allusion to the true poet.
727	Cui nihil satis, huic etiam nihil turpe.				Nothing will be base to him for whom nothing is enough.	The man is troubled with no scruples, who covets unlimited wealth.
728	Cui non conveniat sua res, ut calceus olim, Si pede major erit, subvertet; si minor, uret.		Horace		To him who is not satisfied with his fortune, it is as with a shoe; if it is too large for his foot it will upset him, if too small, it will pinch him.	
729	Cui placet alterius, sua nimirum est odio sors.		Horace		When a man is captivated with the lot of another, no wonder if he is discontented with his own.	
730	Cui placet, obliviscitur; cui dolet, meminit.				He who is pleased at a thing, forgets it; he who is grieved at it, bears it in mind.	
731	Cui prodest scelus, is fecit.		Seneca		He who profits by the villany, has perpetrated it.	This is true in reference to the share of criminality which attaches to the "accomplice after the fact," but is not of universal application.
732	Cuicunque aliquis quid concedit, concedere videtur et id, sine quo res ipsa esse non potest.	legal maxim			He who makes a grant to another, is held to have granted that as well, without which the thing so granted cannot be enjoyed.	A house or land, for instance, cannot be sold without right of ingress to it, if in the vendor's power to grant it.
733	Cuilibet in arte sua perito est credendum.		Edward Coke		Every man ought to have credit for skill in his own art.	
734	Cuivis dolori remedium est patientia.		Publilius Syrus		Patience is the remedy for every sorrow.	
735	Cujus conatibus obstat Res angusta domi.		Horace		Whose efforts are frustrated by the narrowness of his means.	The fate of too many!
736	Cujus est solum, ejus est usque ad caelum.	legal maxim			To him to whom the soil belongs, belongs everything over it, even to the sky.	The building of no man, for instance, may project over the land of his neighbour.
737	Cujus summa est.				Of which the sum and substance is.	This is the long and short of it.
738	Cujus tu fidem in pecunia perspexeris, Verere ei verba credere?		Terence		Do you fear to trust a man with your secret, of those honesty in pecuniary matters you have had experience?	
739	Cujus vita despicitur, restat ut ejus praedicatio contemnatur.		gregorius magnus		When a man's life is despised, it follows that his preaching must fall into contempt.	The necessity of supporting precept by practice.
740	Cujus vulturis hoc erit cadaver?		Martial		To what vulture's share shall this carcass fall?	
741	Cujuslibet rei simulator atque dissimulator.		Sallust		A man who possessed the power on every occasion to seem to be what he was not, and to conceal what he really was.	The character of Catiline, a finished hypocrite, as portrayed by Sallust.
742	Cujusvis hominis est errare, nullius nisi insipientis in errore perseverare.		Cicero		Every man is liable to err, but it is only the part of a fool to persevere in error.	
743	Culpa sua damnum sentiens, non intelligitur damnum pati.	legal maxim			He who suffers a loss by his own fault, is not considered (by the law) a sufferer.	
744	Culpam poena premit comes.		Horace		Punishment follows hard upon crime.	
745	Cultaque Judaeo septima sacra Syro.		Ovid		And the seventh day kept holy and observed by the Syrian Jew.	
746	Cum corpore mentem Crescere sentimus, pariterque senescere.		Lucretius		We feel that the mental powers increase with those of the body, and, in like manner, grow feeble with it.	
747	Cum domus ingenti subito mea lapsa ruina Concidit, in domini procubuitque caput.		Ovid		When my house came suddenly down, and fell in ruins with a tremendous crash upon its master's head.	
748	Cum dubia et fragilis sit nobis vita tributa, In morte alterius spem tu tibi ponere noli.		cato		Seeing that life has been given us precarious and full of uncertainty, fix not thy hopes on the death of another.	
749	Cum duo inter se pugnantia reperiuntur in testamento, ultimum ratum est.		Edward Coke		When two clauses are found in a will, repugnant to each other, the last holds good.	But in deeds, the first holds good.
750	Cum duplicantur lateres venit Moses.				When the tale of bricks is doubled, then comes Moses;	to the rescue of the Israelites. A mediaeval proverb, meaning that, "when things are at the worst they will mend."
751	Cum est concupita pecunia, nec ratio sanat cupiditatem, existit morbus animi eique morbo nomen est avaritia.		Cicero		When money is coveted, and the desire is not cured by reason, there is a disease of the mind, and the name of that disease is 'avarice.'	
752	Cum feriunt unum, non unum fulmina terrent.		Ovid		When the lightning strikes but one, not one only does it alarm.	
753	Cum fortuna manet, vultum servatis amici; Cum cedit, turpi vertitis ora fuga.		Petronius		While prosperity lasts, you, my friends, give me your countenance; when it fails, you turn away your faces in disgraceful flight.	
754	Cum fortuna perit, nullus amicus erit.				When fortune fails us, we shall have no friend left.	
755	Cum fueris felix, quae sunt adversa caveto; Non eadem cursu respondent ultima primis.		cato		When you are enjoying prosperity, provide against adversity; the end of life will not be attended by the same train of fortunate circumstances as the beginning.	
756	Cum furor haud dubius, cum sit manifesta phrenesis, Ut locuples moriaris, egentis vivere fato.		Juvenal		Since it is undoubted madness, manifest insanity, to live the life of a beggar that you may die rich.	
757	Cum grano salis.	proverb			With a grain of salt.	With something which will help us to swallow it; with some latitude or allowance. Said of anything to which we are unable to give implicit credence.
758	Cum larvis luctari.	proverb			To wrestle with ghosts.	To speak ill of the dead. See De mortuis, &c.
759	Cum licet fugere ne quaere litem.	proverb			When you can escape it, avoid a law-suit.	
760	Cum lux altera venit, Jam eras hesternum consumpsimus; ecce aliud cras Egerit hos annos.		Persius		When another day arrives, we have consumed the morrow of yesterday; behold, another morrow comes, and so wastes our years.	A censure against procrastination, "the thief of time."
761	Cum magna malae superest audacia causae, Creditur a multis fiducia.		Juvenal		When a bad cause is backed by great impudence, it is believed by many to be the boldness of innocence.	
762	Cum magnis virtutibus affers Grande supercilium.		Juvenal		With thy high virtues thou dost bring great superciliousness.	
763	Cum moritur dives concurrunt undique cives; Pauperis ad funus vix est e millibus unus.				When a rich man dies, the citizens flock together from every side; at a poor man's funeral there is hardly one out of thousands.	Mediaeval Leonine lines.
764	Cum multis aliis, quae nunc perscribere longum est.				With many other things which it would now be tedious to set forth in writing.	A line often used in an ironical sense. To whom does it belong?
765	Cum plus sint potae, plus potiuntur aquae.				The more water is drunk, the more is desired.	See Quo plus, &c.
766	Cum prostrata sopore Urget membra quies, et mens sine pondere ludit.		Petronius		When repose steals over the limbs, extended in sleep, and the mind disports without restraint.	
767	Cum pulchris tunicis sumet nova consilia et spes.		Horace		Happy in his fine clothes, he will adopt new plans and cherish fresh hopes.	
768	Cum surges abitura domum, surgemus et omnes.		Ovid		When you rise to go home, we will all rise too.	
769	Cum tabulis animum censoris sumat honesti.		Horace		Let him, with his papers, assume the spirit of an honest critic.	
770	Cum tristibus severe, cum remissis jucunde, cum senibus graviter, cum juventute comiter vive.		Cicero		With those who are of a gloomy turn, be serious; with the idle, be cheerful; with the old, be grave; and with the young, be gay.	
771	Cum volet illa dies, quae nil nisi corporis hujus Jus habet, incerti spatium mihi finiat aevi.		Ovid		Let that day, which has no power but over this body of mine, put an end to the term of my uncertain life, when it will.	
772	Cuncta prius tentata: sed immedicabile vulnus Ense recidendum, ne pars sincera trahatur.		Ovid		All methods have been already tried; but a wound that admits of no cure must be cut away, that the sounder parts may not be corrupted.	
773	Cunctando restituit rem.		Ennius		He saved the state by delay.	Said in praise of Fabius, who saved Rome by avoiding an engagement with Hannibal.
774	Cuncti adsint, meritaeque expectent praemia palmae.		Virgil		Let all attend, and await the reward of well-earned laurels.	
775	Cunctis servatorem liberatoremque acclamantibus.				All hailing him as their saviour and deliverer.	
776	Cupido dominandi cunctis affectibus flagrantior est.		Tacitus		The desire of rule is the most powerful of all the affections of the mind.	
777	Cur ante tubam tremor occupat artus?		Virgil		Why does tremor seize the limbs before the trumpet sounds?	That is, before the signal for battle.
778	Cur in theatrum, Cato severe, venisti?		Martial		Why, Cato, with all thy gravity, didst thou come to the theatre?	On the occasion of the indecent celebration of the Floralia, when he only came that he might be seen to depart. See An ideo, &c. (App.)
779	Cur indecores in limine primo Deficimus?		Virgil		Why faint we inglorious at the very outset?	
780	Cur me querelis exanimas tuis?		Horace		Why worry me to death with your complaints?	
781	Cur moriatur homo qui sumit de cinamomo?	maxim of the School of Health at Salerno			Why should the man die who takes cinnamon?	
782	Cur moriatur homo, cut salvia crescit in horto?	maxim of the School of Health at Salerno			Why should the man die in whose garden sage grows?	"He that would live for aye, Must eat sage in May." Sage is a good stomachic, and its medicinal qualities were highly valued in former times. It is said to have derived its name from the Latin salvus, "safe," or "healthy."
783	Cur nescire, pudens prave, quam discere malo?		Horace		Why do I prefer, through false modesty, to be ignorant rather than learn?	
784	Cur non, ut plenus vitae conviva, recedis? Aequo animoque capis securam, stulte, quietem.		Lucretius		Why not, fool, like a well-filled guest at life's banquet, withdraw, and, with contented mind, take a repose that is removed from every care?	
