id	quotation	type	source_1	source_2	translation	notes
1735	Heu! Quam miserum est ab eo laedi, de quo non ausis queri.		Publilius Syrus		Alas! how grievous is it to be injured by one against whom you dare make no complaint.	
1736	Heu! Quanto minus est cum reliquis versari, quam tui meminisse!				Alas! how little the pleasure of conversing with those who are left, compared with that of remembering thee.	Shenstone's epitaph on Miss Dolman. "To live with them is far less sweet Than to remember thee." Moore.
1737	Heu! totum triduum.		Terence		Alas! a whole three days.	The language of an impatient lover.
1738	Hi motus animarum, atque haec certamina tanta Pulveris exigui jactu compressa quiescent.		Virgil		These commotions of their minds, and these mighty frays, checked by the throwing of a little dust, will cease.	Said of the battles of the bees. These lines have been applied to the Carnival of the Roman Church, and the season of repose which follows immediately after the ceremony of sprinkling the ashes on Ash Wednesday.
1739	Hi narrata ferunt alio; mensuraque ficti crescit; et auditis aliquid novus adjicit auctor.		Ovid		These carry elsewhere what has been told them; the sum of the falsehood is ever on the increase, and each fresh narrator adds something to what he has heard.	
1740	Hiatus maxime deflendus.				A deficiency very much to be deplored.	Words used to mark a blank in a work, which has been rendered defective by accident or time. It is sometimes used in an ironical sense, in reference to speakers or other persons who make great promises, which they fail to perform.
1741	Hibernicis ipsis Hibernior.				More Irish than the Irish themselves.	A specimen of modern dog Latin, quoted against those who are guilty of bulls or other absurdities.
1742	Hic coquus scite ac munditer condit cibos.		Plautus		This cook seasons his dishes well, and serves them up neatly.	
1743	Hic dies vere mihi festus atras Eximet curas.		Horace		This day, to me a real festival, shall expel gloomy cares.	Said originally in reference to the day on which Augustus returned to Rome from Spain.
1744	Hic est aut nusquam quod quaerimus.		Horace		What we seek is either here or nowhere.	
1745	Hic est muero defensionis meae.		Cicero		This is my weapon of defence.	This is the point of my argument.
1746	Hic et ubique.				Here and everywhere.	Words sometimes used in reference to the omnipresence of the Deity.
1747	Hic finis fandi.				Here ends the discourse.	Let our conversation end here.
1748	Hic funis nihil attraxit.	proverb			This line has taken no fish.	This plan has not answered.
1749	Hic gelidi fontes, hic mollia prata, Lycori, Hic nemus, hic toto tecum consumerer aevo.		Virgil		Here are cooling springs, here grassy meads; here, Lycoris, the grove; here with thee could I pass my whole life.	
1750	Hic locus est, partes ubi se via findit in ambas.		Virgil		This is the spot where the road divides into two parts.	
1751	Hic manus, ob patriam pugnando vulnera passi, Quique pii vates, et Phoebo digna locuti: Inventas aut qui vitam excoluere per artes, Quique sui memores alios fecere merendo.		Virgil		Here is a band of those who have sustained wounds in fighting for their country; pious poets, who sang in strains worthy of Apollo; those who improved life by the invention of arts, and who, by their deserts, have made others mindful of them.	
1752	Hic murus aheneus esto, Nil conscire sibi, nulla pallescere culpa.		Horace		Let this be as a brazen wall of defence, to be conscious of no guilt, to turn pale at no accusation.	An admirable picture of the advantages of a good conscience.
1753	Hic nigrae succus loliginis, haec est Aerugo mera.		Horace		This is the invention of black envy, this is sheer cankered malice.	
1754	Hic patet ingeniis campus, certusque merenti Stat favor: ornatur propriis industria donis.		Claudian		Here lies a field open for talent, and certain favour awaits the deserving; industry is graced with her appropriate reward.	
1755	Hic poterit cavere recte, jura qui et leges tenet.		Plautus		He will he able to take all due precautions, who understands the laws and ordinances.	
1756	Hic rogo, non furor est ne moriare mori?		Martial		I ask, is it not downright madness to kill yourself, that you may not die?	"How! leap into the pit our life to save? To save our life leap all into the grave?" Cowper.
1757	Hic secura quies, et nescia fallere vita, Dives opum variarum; hic latis otia fundis, Speluncae, vivique lacus; hic frigida Tempe, Mugitusque boum, mollesque sub arbore somni.		Virgil		Here is quiet free from care, and life ignorant of guile, rich in varied opulence; here are peaceful retreats in ample fields, grottoes and refreshing lakes; here are cool valleys, and the lowing kine, and soft slumbers beneath the tree.	The first hic is here substituted for at.
1758	Hic segetes, illuc veniunt felicius uvae: Arborei foetus alibi, atque injussa virescunt Gramina.		Virgil		Here grain, there grapes more abundantly grow; nurseries of trees elsewhere, and grass spontaneously spring up.	
1759	Hic situs est Phaeton currus auriga paterni; Quem si non tenuit, magnis tamen excidit ausis.		Ovid		Here Phaeton lies buried, the driver of his father's car; which if he did not manage, still he miscarried in a great attempt.	The epitaph on the rash son of Apollo.
1760	Hic transitus efficit magnum vitae compendium.				This change effects a great saving of our time.	
1761	Hic ubi nunc urbs est, tum locus urbis erat.		Ovid		Here, where now the city stands, was then the city's site.	
1762	Hic ver assiduum, atque alienis mensibus aestas.		Virgil		Here is everlasting spring, and summer in months that are not her own.	
1763	Hic vivimus ambitiosa Paupertate omnes.		Juvenal		Here we all live in an ostentatious poverty.	The poorest man in a company is very often found to have the best coat.
1764	Hilarisque tamen cum pondere virtus.		statius		Virtue may be gay, but with dignity.	Be merry and wise.
1765	Hinc illae lachrymae.		Horace		Hence those tears.	The cause of his grief is now seen.
1766	Hinc omne principium, huc refer exitum.		Horace		To this refer every undertaking, to this the issue thereof.	To the decrees of Providence.
1767	Hinc subitae mortes atque intestata senectus.		Juvenal		Hence arise sudden deaths, and an intestate old age.	Debauchery and excesses cut short the lives of their votaries, and by a sudden death deprive them of the opportunity of making their will.
1768	Hinc tibi copia Manabit ad plenum benigno Ruris honorum opulenta cornu.		Horace		Here plenty, rich in rural honours, shall flow for you, with her generous horn full to the very brim.	In allusion to the Cornucopia.
1769	Hinc totam infelix vulgatur fama per urbem.		Virgil		Hence the unhappy report was spread throughout the whole city.	
1770	Hinc usura vorax, avidumque in tempore foenus, Et concussa fides, et multis utile bellum.		Lucan		Hence devouring usury, and interest accumulating by lapse of time — hence shaken credit, and warfare profitable to the many.	
1771	Hinc venti dociles resono se carcere solvunt, Et cantum accepta pro libertate rependunt.				Hence the obedient winds are loosed from their durance as they sound, and give melody in return for the liberty they have received.	Words very applicable to the Aeolian harp.
1772	Hirundinem sub eodem tecto ne habeas.	proverb			Do not have a swallow under the same roof.	Do not make friends of those who will leave you when the spring and fair weather are past.
1773	Hirundines aestivo tempore praesto sunt: frigore pulsae recedunt. Ita falsi amici.		Rhetorica ad Herennium		The swallows in summer are among us; in cold weather they are driven away. So it is with false friends.	Such friends may justly be called fair-weather friends.
1774	His lachrymis vitam damus, et miserescimus ultro.		Virgil		To these tears we concede his life, and willingly show mercy.	
1775	His legibus solutis respublica stare non potest.		Cicero		These laws once repealed, the republic cannot last.	
1776	His nunc praemium est, qui recta prava faciunt.		Terence		In these days they are rewarded who make right appear wrong.	
1777	His saltem accumulem donis, et fungar inani Munere.		Virgil		These offerings at least I would bestow upon him, and discharge this unavailing duty.	A quotation often used with reference to distinguished men when deceased.
1778	Hoc age.				Do this.	Or "attend to this."
1779	Hoc decet uxores; dos est uxoria lites.		Ovid		This befits wives only; strife is the dowry of a wife.	
1780	Hoc erat in more majorum.				This was the custom of our forefathers.	
1781	Hoc erat in votis; modus agri non ita magnus; Hortus ubi, et tecto vicinus jugis aquae fons, Et paulum silvae super his foret.		Horace		This was ever the extent of my wishes; a portion of ground not over large, in which is a garden, and a fountain with its continual stream close to my house, and a little woodland beside.	
1782	Hoc est quod palles? cur quis non prandeat, hoc est?		Persius		Is it for this you grow pale? Is it for this that one should go without his dinner?	
1783	Hoc est Vivere bis, vita posse priore frui.		Martial		It is to live twice over, to be able to enjoy the retrospect of our past life.	
1784	Hoc fonte derivata clades, In patriam, populumque fluxit.		Horace		Derived from this source, perdition has overwhelmed the nation and the people.	The poet says that the misfortunes of the Romans in their wars with the Parthians originated in the depravity then universally prevalent.
1785	Hoc maxime officii est, ut quisquis maxime opus indigeat, ita ei potissimum opitulari.		Cicero		It is more especially our duty, to aid him in preference who stands most in need of our assistance.	
1786	Hoc opus, hoc studium, parvi properemus et ampli, Si patriae volumus, si nobis vivere cari.		Horace		Let us, both small and great, push forward in this work, in this pursuit; if to our country, if to ourselves, we would be dear.	
1787	Hoc pretium ob stultitiam fero.		Terence		This is the reward I gain for my folly.	
1788	Hoc quoque, quam volui, plus est. Cane, Musa, receptus.		Ovid		Even this is more than I wished to say. My Muse, sound a retreat.	
1789	Hoc scio pro certo, quod si cum stercore certo, Vinco seu vincor, semper ego maculor.				This I know for certain, that when I contend with filth, whether I vanquish or am vanquished, I am always soiled.	Leonine rhymes.
1790	Hoc scito, nimio celerius Venire quod molestum est, quam id quod cupide petas.		Plautus		Know this, that that which is disagreeable comes much more speedily than that which you eagerly desire.	
1791	Hoc tibi sit argumentum, semper in promptu situm, Ne quid expectes amicos facere, quod per te queas.				Let this be your rule of life, always to be acted upon, expect not your friends to do anything that you can do yourself.	
1792	Hoc tolerabile si non Et furere incipias.		Juvenal		This might be endurable, if you did not begin to rave.	
1793	Hoc volo, sic jubeo, &c.					See Sic volo, &c.
1794	Hodie mihi, cras tibi.	proverb			Today for myself, tomorrow for you.	Inscribed over the elder Wyatt's epitaph at Ditchley.
1795	Hodie nihil, cras credo.		Marcus Terentius Varro		Tomorrow I will trust, not today.	See Cras credimus, &c.
1796	Hodie vivendum amissa praeteritorum cura.				Let us live today, dismissing all care for the past.	Epicurean advice, given by a boon companion.
1797	Homine imperito nunquam quidquam injustius, Qui, nisi quod ipse facit, nil rectum putat.		Terence		There is nothing more unreasonable than a man who wants experience, one who thinks nothing right except what he himself has done.	
1798	Hominem non odi sed ejus vitia.				I hate not the man, but his vices.	
1799	Hominem pagina nostra sapit.		Martial		Our pages understand human nature.	We write from experience.
1800	Homines ad deos nulla re propius accedunt quam salutem hominibus dando.		Cicero		In nothing do men more nearly approach the gods, than in giving health to men.	
1801	Homines amplius oculis quam auribus credunt: longum iter est per praecepta, breve et efficax per exempla.		Seneca		Men believe their eyes rather than their ears — the road by precept is long, by example short and sure.	
1802	Homines nihil agendo discunt male agere.		cato		By having nothing to do, men learn to do evil.	For Satan always mischief finds For idle hands to do." Watts."
1803	Homines proniores sunt ad voluptatem, quam ad virtutem.		Cicero		Men are more prone to pleasure than to virtue.	
1804	Homines qui gestant, quique auscultant crimina, Si meo arbitratu liceat, omnes pendeant, Gestores linguis, auditores auribus.		Plautus		Those men who carry about, and those who listen to, accusations, should all be hanged, if I could have my way, the carriers by their tongues, the hearers by their ears.	
1805	Homines quo plura habent, eo ampliora cupiunt.		iustinianus		The more men have, the more they want.	
1806	Hominis est errare, insipientis perseverare.				It is the nature of man to err, of a fool to persevere in error.	
1807	Hominis frugi et temperantis functus officio.		Terence		One who has acted the part of a virtuous and temperate man.	
1808	Hominum sententia fallax.		Ovid		The opinions of men are fallible.	
1809	Homo ad res perspicacior Lynceo vel Argo, et oculeus totus.		Apuleius		A man more clear-sighted than Lynceus or Argus, and eyes all over.	
1810	Homo constat ex duabus partibus, corpore et anima, quorum una est corporea, altera ab omni materiae concretione sejuncta.		Cicero		Man is composed of two parts, body and soul, of which the one is corporeal, the other severed from all combination with matter.	
1811	Homo delirus, qui verborum minutiis rerum frangit pondera.		Aulus Gellius		A foolish man, who fritters away the weight of his subject by fine-spun trifling on words.	
1812	Homo extra est corpus suum cum irascitur.		Publilius Syrus		A man when he is angry is beside himself.	
1813	Homo fervidus et diligens ad omnia paratur. A Kempis de Imit. Christi.				The man who is earnest and diligent is prepared for all things.	
1814	Homo homini aut deus aut lupus.	proverb			Man is to man either a god or a wolf.	
1815	Homo homini deus, si officium sciat.		Pliny the Younger		Man to man is a god, if he knows how to do his duty.	
1816	Homo homini lupus.		Plautus		Man to man is a wolf.	One man's loss is, too often, another man's gain. "Man's inhumanity to man makes countless thousands mourn." Burns.
1817	Homo in Hispaniam natura naturam vitium visum.				A woman about to sail to Spain to see the nature of vines.	A Latin puzzle; the sentence, at first, seeming to have neither grammar nor meaning.
1818	Homo justus nil cuipiam detrahit.		Cicero		A just man speaks ill of no one.	
1819	Homo multa habet instrumenta ad adipiscendam sapientiam.		Cicero		Man possesses numerous means of acquiring wisdom.	
1820	Homo multarum literarum.				A man of many letters.	A man of extensive learning.
1821	Homo multi consilii et optimi.				A man always ready to give his advice, and that the best.	
1822	Homo qui erranti comiter monstrat viam, Quasi lumen de suo lumine accendit, facit; Nihilomunus ipsi luceat, cum illi accenderit.				He who kindly shows the way to one who has gone astray, acts as though he had lighted another's lamp by his own; although it has given light to the other, it still lights him on his way.	So Shakespeare says, "The quality of mercy is twice blessed."
1823	Homo qui in homine calamitoso est misericors, miminit sui.	proverb			A man who is merciful to the afflicted, remembers what is due to himself.	He remembers his duty as a man.
1824	Homo sine religione, sicut equus sine fraeno.	proverb			A man without religion is like a horse without a bridle.	
1825	Homo solus aut deus aut daemon.	proverb			A man to live alone must be either a god or a daemon.	
1826	Homo sum; humani nihil a me alienum puto.		Terence		I am a man, and nothing that concerns a man do I deem a matter of indifference to me.	St. Angustin tells us that on hearing these words of the poet, the theatre resounded with applause.
1827	Homo toties moritur, quoties amittit suos.		Publilius Syrus		A man dies as many times as he loses his relatives.	
1828	Homo trium literarum.		Plautus		A man of three letters.	FUR, "a thief."
1829	Homo unius libri.				A man of one book.	To fix one's mind intently on one book, and master it, is the only way to become truly learned, at least, according to Thomas Aquinas, as quoted by Jeremy Taylor.
1830	Homunculi quanti sunt! cum recogito.		Plautus		What poor creatures are men! when I reflect upon it.	
1831	Honesta mors turpi vita potior.		Tacitus		An honourable death is better than an ignominious life.	The maxim of a martyr.
1832	Honesta paupertas prior quam opes malae.	proverb			Poverty with honesty is better than ill-acquired wealth.	
1833	Honesta quaedam scelera successus facit.		Seneca		Success makes some crimes honourable.	Thus rebellion and conspiracy, though based on fraud and ingratitude, are dignified, if successful, with the name of "revolution."
1834	Honestum non est semper quod licet.	legal maxim			That is not always honourable which is lawful.	If every one scrupulously insisted on his legal rights, the world would De a scene of tenfold litigation. We must "give and take."
1835	Honestum quod vere dicimus, etiamsi a nullo laudatur, laudabile est sua natura.		Cicero		That which we truly call virtuous, even though it be praised by no one, is praiseworthy in its own nature.	
1836	Honestus rumor alterum patrimonium est.		Publilius Syrus		A good name is a second inheritance.	
1837	Honor est praemium virtutis.		Cicero		Honour is the reward of virtue.	
1838	Honora medicum propter necessitatem.	proverb			Make much of a physician through necessity.	
1839	Honores mutant mores.				Honours change manners.	
1840	Honos alit artes.		Cicero		Honours nurture the arts.	See Quis enim, &c.
1841	Horae cedunt, et dies, et menses, et anni, nec praeteritum tempus unquam revertitur.		Cicero		Hours and days, and months and years, pass away, and no time that is once past ever returns.	
1842	Horae Momento cita mors venit, aut victoria laeta.		Horace		In a moment of time comes sudden death, or joyous victory.	The contingencies of a soldier's life.
1843	Horrea formicae tendunt ad inania nunquam; Nullus ad amissas ibit amicus opes.		Ovid		Ants never hend their course to an empty granary; no friend will visit departed wealth.	Said in reference to fair-weather or sunshine friends.
1844	Horresco referens.		Virgil		I shudder as I tell it.	
1845	Horridus miles esse debet, non coelatus auro argentoque, sed ferro et animis fretus. Virtus est militis decus.		Titus Livius		The soldier should inspire terror, and not be adorned with gold and silver, but rely upon his courage and his sword. Valour is the soldier's virtue.	
1846	Horror ubique animos, simul ipsa silentia terrent.		Virgil		Horror seizes their minds, and the very silence is dreadful.	
1847	Hortus siccus.				"Literally, "a dry garden."	A collection of dried plants for the purpose of classification. Applied figuratively to a recital of dry and uninteresting details.
1848	Hos ego versiculos feci, tulit alter honores; Sic vos non vobis fertis aratra boves; Sic vos non vobis mellificatis apes; Sic vos non vobis vellera fertis oves; Sic vos non vobis nidificatis aves.		Virgil		I wrote these lines; another has borne away the honour — Thus do ye, oxen, for others hear the yoke; thus do ye, bees, for others make honey; thus do ye, sheep, wear fleeces for others; thus do ye, birds, for others build nests.	On the occasion of some shows at Rome, the weather was remarkable for tempestuous nights, with fine days. Virgil, then a young man, and unknown, wrote these lines, and fixed them in a conspicuous place: "Nocte pluit tota, redeunt spectacula mane, Divisum imperium cum Jove Caesar habet." "It rains all night, the games return with day, Caesar with Jove thus holds divided sway." The author being inquired for, a poet of the name of Bathyllus claimed the distich, and was rewarded accordingly. Virgil, indignant at this, wrote under the verses the line "Hos ego, Ac.," and the words, "Sic vos non vobis," four times. He alone proving able to complete the lines, of which these words were the beginning, the imposture of Bathyllus was detected, and he was dismissed with disgrace, while Virgil obtained the credit which was his due.
1849	Hospes nullus tam in amici hospitium devorti potest, Quin ubi triduum continuum fuerit, jam odiosus siet, Verum ubi triduum continuos immorabitur, Tametsi dominus non invitus patitur, servi murmurant.		Plautus		No guest can be hospitably entertained by a friend, but what when he has been there three days together, he must become a bore; but when he prolongs his stay for ten successive days, even should the master willingly allow it, the servants grumble.	
1850	Hospitis antiqui solitas intravimus aedes.		Ovid		We entered the well-known abode of an old friend.	
1851	Hostis est uxor invita quae ad virum nuptum datur.		Plautus		That wife is an enemy who is given to a man in marriage against her will.	
1852	Huc natas adjice septem, Et totidem juvenes, et mox generosque nurusque, Quaerite nunc, habeat quam nostra superbia causam.		Ovid		Add to this my seven daughters, and as many sons, and ere long my sons-in-law and daughters-in-law; then inquire what reason I have for being proud.	The vainglorious words of the unfortunate Niobe.
1853	Huc propius me, Dum doceo insanire omnes, vos ordine adite.		Horace		Hither, all of you, come near me in order, while I convince you that you are mad.	
1854	Huic maxime putamus malo fuisse, nimiam opinionem ingenii atque virtutis.		Cornelius Nepos		This we think was his especial misfortune, that he entertained too high an opinion of his own genius and valour.	The character of Themistocles.
1855	Huic versatile ingenium sic pariter ad omnia fuit, ut natum ad id unum diceres, quodcunque ageret.		Titus Livius		This man's genius was so versatile, so equally adapted to every pursuit, that in whatever he engaged, you would pronounce him to have been born for that very thing alone.	The character of the elder Cato.
1856	Hujus aquae tactus depellit daemonis actus.				The contact of this water dispels the wiles of the devil.	A mediaeval line describing the alleged virtues of holy water.
1857	Humani nihil alienum.		Terence		Nothing that concerns a man is indifferent to me.	Motto of Earl Talbot.
1858	Humanitati qui se non accommodat, Plerumque poenas oppetit superbiae.		Phaedrus		He who does not conform to courtesy, mostly pays the penalty of his superciliousness.	
1859	Humanum amare est, humanum autem ignoscere est.		Plautus		It is natural to love, and it is natural also to be considerate.	
1860	Humanum est errare.				It is the nature of man to err.	The result of his finite comprehension. "To err is human, to forgive divine." Pope.
1861	Humanum facinus factum est. Actutum fortunae solent mutarier. Varia vita est.		Plautus		The common course of things has happened. Fortunes are wont to change upon the instant. Life is chequered.	
1862	Humiles laborant ubi potentes dissident.		Phaedrus		The humble are in danger, when the powerful disagree.	See Quicquid delirant, &c.
1863	Hunc comedendum et deridendum vobis propino.		Terence		I make him over to you to eat and drink him to the very dregs.	The figure is taken from the custom of tasting of a cup of wine, and then handing it to another.
1864	Hysteron proteron.				The last first.	The Greek hýsteron próteron, Latinized. A figure of speech in which the order of things is inverted, as in the lines of Virgil, Georg. b. iii. l. 60, and Aen. b. iii. l. 662. See also Aen. b. ii. l. 353, — Moriamur, et in media arma ruamus. — "Let us die, and rush upon their weapons."
1865	I demens! et saevas curre per Alpes, Ut pueris placeas, et declamatio fias.		Juvenal		Go, madman! run over the rugged Alps, that thou	
1866	I nunc, et veterum nobis exempla virorum, Qui forti casum mente tulere refer.		Ovid		Come now, and recount to me the examples of men of ancient times, who have endured evils with fortitude.	
1867	I nunc, magnificos, victor, molire triumphos, Cinge comam lauro, votaque redde Jovi.		Ovid		Go now, thou conqueror, acquire splendid triumphs, encircle thy brows with laurel, and pay thy vows to Jove.	
1868	I, bone, quo virtus tua te vocat; i pede fausto, Grandia laturus meritorum praemia.		Horace		Go, my brave fellow, whither your valour calls you, go with prosperous step, certain to receive the ample rewards of your merit.	Words addressed to a soldier who had by his valour already won a purse of gold. To which he made answer, Ibit eo quo, &c, which see.
1869	I. E.				That is.	for id est.
1870	I. H. S.				"It may mean, Jesus hominum Salvator, "Jesus the Saviour of men," or In hoc solus, "In him is salvation." Or for the beginning of the Greek IHESOUS, "Jesus."	An inscription sometimes attached to the figure of the cross.
1871	I. N. R. I.				Jesus of Nazareth, King of the Jews.	for Jesus Nazarenus Rex Judaeorum. The inscription over the cross.
1872	I. Q.				The same as.	for idem quod.
1873	Ibi omnis Effusus labor.		Virgil		There all his labour is lost.	Said of Orpheus, who lost Eurydice when bringing her back from the infernal regions.
1874	Ibis, redibis, non morieris in bello.				Thou shalt go, thou shalt return, thou shalt not die in battle.	This may be also read, by changing the punctuation, Ibis, redibis non, morieris in bello. "Thou shalt go, thou shalt not return, thou shalt die in battle." An ambiguous answer given by an oracle; which, as punctuation was not used in ancient times, might save the credit of the oracle either way.
