id	quotation	type	source_1	source_2	translation	notes
1255	Et neque jam color est misto candore rubori; Nec vigor, et vires, et quae modo visa placebant; Nec corpus remanet.		Ovid		And now, no longer is his complexion of white mixed with red; neither his vigour nor his strength, nor the points which charmed when seen so lately, nor even his body, now remains.	
1256	Et nova fictaque nuper habebunt verba fidem, si Graeco fonte cadunt parce detorta.		Horace		And new and lately invented terms will have authority, if they are derived from Greek sources, with but little deviation.	
1257	Et nulli cessura fides, sine crimine mores, Nudaque simplicitas, purpureusque pudor.		Ovid		A fidelity that will yield to none, manners above reproach, ingenuousness without guile, and blushing modesty.	
1258	Et nunc omnis ager, nunc omnis parturit arbos; Nunc frondent sylvae, nunc formosissimus annus.		Virgil		And now every field, now every tree, is budding forth; now the woods look green; now most beauteous is the year.	A description of Spring.
1259	Et peccare nefas, aut pretium est mori.		Horace		It is forbidden to sin, or the reward is death.	The sin to which the poet alludes, is that of adultery, as punished by the Scythians. So in Scripture, "The wages of sin is death." Rom. vi. 23.
1260	Et Phoebo digna locuti, Quique sui memores alios fecere merendo; Omnibus his nivea cinguntur tempora vitta.		Virgil		Those who have uttered things worthy of Phoebus, and those who have made others mindful of them by their merits, all these have their temples bound with the snow-white fillet.	In his description of the rewards of Elysium, the poet classes his brethren, the disciples of Phoebus, with the benefactors of mankind.
1261	Et pudet, et metuo, semperque eademque precari, Ne subeant animo taedia justa tuo.		Ovid		I am both ashamed and I dread to be always making the same entreaties, lest a justifiable disgust should take possession of your feelings.	
1262	Et quae sibi quisque timebat, Unius in miseri exitium conversa tulere.		Virgil		And what each man dreaded for himself, they bore lightly, when centred in the destruction of one wretched creature.	A picture of the readiness with which man makes a scapegoat of his fellow-man.
1263	Et quando uberior vitiorum copia? Quando Major avaritiae patuit sinus? Alea quando Hos animos?		Juvenal		And when was vice ever in greater force? When was there ever a greater scope for avarice? When did the dice more thoroughly enthral the minds of men?	
1264	Et qui aliis nocent, ut in alios liberales sint, in eadem sunt injustitia, ut si in suam rem aliena convertant.		Cicero		And those who injure one party to benefit another, are quite as unjust, as if they converted the property of others to their own benefit.	
1265	Et qui nolunt occidere quenquam Posse volunt.		Juvenal		Even those who have no wish to slay another, are wishful to have the power.	In allusion to the ambitious thirst for power.
1266	Et quiescenti agendum est, et agenti quiescendum est.		Seneca		He who is indolent should labour, and he who labours should take repose.	
1267	Et rident stolidi verba Latina.		Ovid		And the fools laugh at Latin words.	
1268	Et sanguis et spiritus pecunia mortalibus.	proverb			Money is both blood and life to men.	
1269	Et sequentia.				And what follows.	Generally written in short, et seq.
1270	Et si non aliqua nocuisses, mortuus esses.		Virgil		And if you could not have hurt him some way or other, you would have died (of spite).	
1271	Et sic de similibus.				And so of the like.	
1272	Et tenuit nostras numerosus Horatius aures.		Ovid		Horace too, with his varied numbers, charmed my ears.	
1273	Et veniam pro laude peto; laudatus abunde, Non fastiditus si tibi, lector, ero.		Ovid		Pardon too, in place of praise, do I crave; abundantly, reader, shall I be praised, if I do not cause thee disgust.	
1274	Et vitam impendere vero.				And in the cause of truth to lay down life.	
1275	Etenim omnes artes quae ad humanitatem pertinent, habent quoddam commune vinculum, et quasi cognatione quadan inter se continentur.		Cicero		All the arts appertaining civilized life, are united by a kind of common bond, and are connected, as it were, by a certain relationship.	
1276	Etiam capillus unus habet umbram suam.		Publilius Syrus		Even a single hair has its shadow.	The most trivial thing has its utility and importance.
1277	Etiam celeritas in desiderio, mora est.		Publilius Syrus		In desire, even swiftness itself is delay.	
1278	Etiam fera animalia, si clausa teneas, virtutis obliviscuntur.				Savage animals even, if you keep them in confinement, forget their ferocious disposition.	
1279	Etiam fortes viros subitis terreri.		Tacitus		The minds of resolute men even may be alarmed by sudden events.	And on the other hand, weak men are then found resolute.
1280	Etiam in secundissimis rebus maxime est utendum consilio amicorum.		Cicero		Even in our greatest prosperity, we ought by all means to take the advice of our friends.	
1281	Etiam innocentes cogit mentiri dolor.		Publilius Syrus		Pain makes even the innocent liars.	
1282	Etiam oblivisci quod scis, interdum expedit.		Publilius Syrus		It is sometimes as well to forget what you know.	
1283	Etiam Parnassia laurus Parva sub ingenti matris se subjicit umbra.		Virgil		Ever, the Parnassian laurel shelters itself beneath the dense shade of its mother.	Said of the suckers which shoot up from the root.
1284	Etiam sanato vulnere cicatrix manet.		Publilius Syrus		Even when the wound is healed the scar remains.	Injuries are more often forgiven than forgotten.
1285	Etiam si Cato dicat.	proverb			Even if Cato were to say so.	I would not believe it: Cato being a man of the most scrupulous integrity.
1286	Etiam stultis acuit ingenium fames.		Phaedrus		Hunger sharpens even the wits of fools.	
1287	Etsi pervivo usque ad summam aetatem, tamen Breve spatium est perferundi quae minitas mihi.		Plautus		Though I should live even to an extreme age, still, short is the time for enduring what you threaten me with.	
1288	Euge poetae.		Persius		Well done, ye poets!	
1289	Eum ausculta, cui quatuor sunt aures.	proverb			Listen to him who has four ears.	Attend to persons who show themselves more ready to hear than to speak.
1290	Eventus stultorum magister est.		Titus Livius		Experience is the master of fools.	Fools are only to be taught by experience.
1291	Eversis omnibus rebus, quum consilio profici nihil possit, una ratio videtur; quidquid evenerit, ferre moderate.		Cicero		When we are utterly ruined, and when no counsel can profit us, there seems to be one way open to us; whatever may happen, to bear it with moderation.	
1292	Evolare rus ex urbe tanquam ex vinculis.		Cicero		To fly from the town into the country, as though from chains.	
1293	Ex abundanti cautela.				From excess of precaution.	
1294	Ex abusu non arguitur ad usum.	legal maxim			We must not argue, from the abuse of a thing, against the use of it.	
1295	Ex abusu non argumentum ad desuetudinem.	legal maxim			The abuse of a thing is no argument for its discontinuance.	
1296	Ex aequo et bono judicare.				To judge in fairness and equity.	
1297	Ex arena funiculum nectis.	proverb			You are for making a rope of sand.	You are attempting an impossibility.
1298	Ex auribus cognoscitur asinus.	proverb			An ass is known by his ears.	
1299	Ex cathedra.				From the chair (or pulpit).	Coming from high authority, and therefore to be relied on.
1300	Ex concesso.				From what has been conceded.	An argument ex concesso, or from what the opponent has admitted.
1301	Ex contractu.				From contract.	
1302	Ex curia.				Out of court.	
1303	Ex debito justitiae.				From what is due to justice.	
1304	Ex delicto.				From the crime.	
1305	Ex desuetudine amittuntur privilegia.	legal maxim			Rights are forfeited by non-user.	
1306	Ex diuturnitate temporis omnia praesumuntur esse solemniter acta.	legal maxim			From length of time everything is presumed to have been solemnly done.	
1307	Ex eodem ore calidum et frigidum efflare.				To blow hot and cold with the same mouth.	This adage is founded on the Fable of the Satyr and the Traveller.
1308	Ex factis non ex dictis amici pensandi.		Titus Livius		Friends are to be estimated from their deeds, not their words.	
1309	Ex factis non ex dictis amici pensandi.		Titus Livius		Friends are to be estimated from their deeds, not their words.	
1310	Ex facto jus oritur.	legal maxim			The law arises from the fact.	Until the nature of the crime is known, the law cannot be put in force.
1311	Ex facto jus oritur.	legal maxim			The law arises from the fact.	Until the nature of the crime is known, the law cannot be put in force.
1312	Ex habitu homines metientes.		Cicero		Estimators of men from their outward appearances.	
1313	Ex habitu homines metientes.		Cicero		Estimators of men from their outward appearances.	
1314	Ex humili magna ad fastigia rerum Extollit, quoties voluit fortuna jocari.		Juvenal		As oft as fortune is in sportive mood, she raises men from an humble station to the highest pinnacle of power.	
1315	Ex humili magna ad fastigia rerum Extollit, quoties voluit fortuna jocari.		Juvenal		As oft as fortune is in sportive mood, she raises men from an humble station to the highest pinnacle of power.	
1316	Ex inimico cogita posse fieri amicum.		Seneca		Think that you may possibly make of an enemy a friend.	Avoid extremes in enmities. See Amicum, &c.
1317	Ex inimico cogita posse fieri amicum.		Seneca		Think that you may possibly make of an enemy a friend.	Avoid extremes in enmities. See Amicum, &c.
1318	Ex magna coena stomacho fit maxima poena, Ut sis nocte levis, sit tibi coena brevis.				From a heavy supper great uneasiness to the stomach is produced; that you may enjoy a good night's rest, let your supper be moderate.	A Leonine or rhyming couplet, not improbably issued by the School of Health at Salerno.
1319	Ex magna coena stomacho fit maxima poena, Ut sis nocte levis, sit tibi coena brevis.				From a heavy supper great uneasiness to the stomach is produced; that you may enjoy a good night's rest, let your supper be moderate.	A Leonine or rhyming couplet, not improbably issued by the School of Health at Salerno.
1320	Ex malis moribus bonae leges natae sunt.		Edward Coke		From bad manners good laws have sprung.	
1321	Ex malis moribus bonae leges natae sunt.		Edward Coke		From bad manners good laws have sprung.	
1322	Ex mero motu.				From a mere motion;	of one's own free will.
1323	Ex mero motu.				From a mere motion;	of one's own free will.
1324	Ex necessitate rei.				From the urgency of the case.	
1325	Ex necessitate rei.				From the urgency of the case.	
1326	Ex nihilo nihil fit.				From nothing nothing is made.	Nothing can come of nothing.
1327	Ex nihilo nihil fit.				From nothing nothing is made.	Nothing can come of nothing.
1328	Ex officio.				By virtue of his office.	
1329	Ex officio.				By virtue of his office.	
1330	Ex otio plus negotii quam ex negotio habemus.		old scholiast		From our leisure we get more to do, than from our business.	Especially when it gives us the opportunity of falling into mischief.
1331	Ex otio plus negotii quam ex negotio habemus.		old scholiast		From our leisure we get more to do, than from our business.	Especially when it gives us the opportunity of falling into mischief.
1332	Ex parte.	legal concept			On one part.	Evidence given on one side only is called ex parte.
1333	Ex parte.	legal concept			On one part.	Evidence given on one side only is called ex parte.
1334	Ex pede Herculem.	proverb			You may judge of Hercules from his foot.	Pythagoras ascertained the length of the foot of Hercules by taking the length of the Olympic stadium or course, which was six hundred feet, originally measured by the foot of the hero. He thence came to the conclusion that his height was six feet seven inches. From this circumstance was formed the proverb, meaning that we may judge of the whole from the part.
1335	Ex pede Herculem.	proverb			You may judge of Hercules from his foot.	Pythagoras ascertained the length of the foot of Hercules by taking the length of the Olympic stadium or course, which was six hundred feet, originally measured by the foot of the hero. He thence came to the conclusion that his height was six feet seven inches. From this circumstance was formed the proverb, meaning
1336	Ex post facto.	legal concept			Done after another thing.	A law enacted purposely to take cognizance of an offence already committed, is, so far as that individual offence is concerned, an ex post facto law.
1337	Ex post facto.	legal concept			Done after another thing.	A law enacted purposely to take cognizance of an offence already committed, is, so far as that individual offence is concerned, an ex post facto law.
1338	Ex quovis ligno non fit Mercurius.	proverb			A Mercury is not to be made out of every log.	Mercury being a graceful god, it was not out of every piece of wood that his statue could be made.
1339	Ex quovis ligno non fit Mercurius.	proverb			A Mercury is not to be made out of every log.	Mercury being a graceful god, it was not out of every piece of wood that his statue could be made.
1340	Ex tempore.				Off-hand.	On the spur of the moment, or, without preparation.
1341	Ex tempore.				Off-hand.	On the spur of the moment, or, without preparation.
1342	Ex umbra in solem.	proverb			Out of the shade into the sunshine.	You have rendered clear what was obscure before.
1343	Ex umbra in solem.	proverb			Out of the shade into the sunshine.	You have rendered clear what was obscure before.
1344	Ex ungue leonem.	proverb			You can tell the lion by his claw.	The master's hand may be known in the specimen.
1345	Ex ungue leonem.	proverb			You can tell the lion by his claw.	The master's hand may be known in the specimen.
1346	Ex uno disce omnes.				From one learn all.	From one example you may judge of all. What has been said of one may be said of the rest. See Crimine ab uno, &c.
1347	Ex uno disce omnes.				From one learn all.	From one example you may judge of all. What has been said of one may be said of the rest. See Crimine ab uno, &c.
1348	Ex uno specta omnia.	proverb			From one circumstance judge of all.	
1349	Ex vita, discedo, tanquam ex hospitio, non tanquam ex domo.		Cicero		I depart from life as from an inn, not as from my home.	I die without regret, just as one quits an inn, where he has been a sojourner for a time only.
1350	Ex vitio alterius sapiens emendat suum.		Publilius Syrus		From the faults of another a wise man corrects his own.	
1351	Ex vitulo bos fit.				The calf becomes an ox.	Small things enlarge to great.
1352	Ex vultibus hominum mores colligere.				To judge of men's manners from their countenance.	
1353	Exceptio probat regulam.	legal maxim			The exception proves the rule.	The fact of there being an exception proves the existence of a rule.
1354	Excepto quod non simul esses, caetera laetus.				Except that you were not with me, I was in other respects happy.	
1355	Excessit ex ephebis.				He is out of his minority.	He is of age, and has come to years of discretion.
1356	Excludat jurgia finis.		Horace		Let this settlement terminate all disputes.	
1357	Excusatio non petita fit accusatio manifesta.	legal maxim			An excuse that is uncalled for is a convincing proof of guilt.	
1358	Exeat aula Qui vult esse pius.		Lucretius		Let him withdraw from court, who wishes to remain uncorrupted.	
1359	Exeat.				Let him depart.	The leave given for temporary absence from college is so called.
1360	Exegi monumentum aere perennius.		Horace		I have completed a monument more durable than brass.	The prophecy of a poet, who formed a just estimate of his works.
1361	Exempli gratia.				For example.	For instance. Usually written e.g.
1362	Exemplo plus quam ratione vivimus.				We live more by example than by reason.	On this is based the tyranny of fashion.
1363	Exemplo quodcunqne malo committitur ipsi Displicet auctori; prima est haec ultio, quod, se Judice, nemo nocens absolvitor.		Juvenal		Every deed that will furnish a precedent for crime, must be condemned by the author himself. This is his first punishment, that, being his own judge, no guilty man is acquitted.	
1364	Exempta juvat spinis e pluribus una.		Martial		A single thorn extracted out of many, is a point gained.	As the passage stands in the original, the poet puts the question, "Of what use is it to have one thorn plucked out when you are smarting from many?"
1365	Exercent illi sociae commercia linguae: Per gestum res est significanda mihi.		Ovid		They enjoy the intercourse of a common language: by me everything has to be signified by gestures.	
1366	Exercitatio optimus est magister.	proverb			Practice is the best master.	
1367	Exercitatio potest omnia.	proverb			Continued practice can accomplish everything.	Practice makes perfect.
1368	Exeunt omnes.				All depart.	A stage direction.
1369	Exi, Intonat horrendum.		Juvenal		Begone! she thunders out with awful voice.	
1370	Exigit et a statuis farinas.	proverb			He exacts meal from a statue even.	He can make something out of everything, and can "get blood out of a stone."
1371	Exigite ut mores teneros ceu pollice ducat, Ut si quis cera vultum facit.		Juvenal		Require him, with his thumb, as it were, to press into shape their unformed morals, just as one forms a face from wax.	Said with reference to the importance of good training in tender years. The poet alludes to the Roman mode of taking portraits in wax.
1372	Exigua est virtus, praestare silentia rebus; At contra, gravis est culpa, tacenda loqui.		Ovid		'Tis a small merit to hold silence upon a matter; on the other hand, it is a serious fault to speak of things on which we ought to be silent.	
1373	Exigui numero, sed bello vivida virtus.		Virgil		Few in number, but valiant in spirit.	
1374	Exiguum est ad legem bonum esse.		Seneca		It is but a slight matter to be good to the letter of the law only.	
1375	Exilis domus est, ubi non et multa supersunt, Et dominum fallunt, et prosunt furibus.		Horace		It is a poor house indeed, in which there are not many superfluities, which escape the master's notice, and fall a prey to thieves.	
1376	Exitio est avidis mare nautis.		Horace		The sea is the destruction of avaricious sailors.	Few will think this an apposite maxim at the present day.
1377	Exitus in dubio est: audebimus ultima, dixit; Viderit, audentes forsne Deusne juvet.		Ovid		'The result is doubtful, we will dare the utmost,' said he, 'Be it chance or be it a Providence that aids the bold, let him see to it.'	
1378	Experientia docet.	proverb			Experience teaches.	Or, as our proverb has it, "Experience makes fools wise."
1379	Experimentum crucis.				Trial by the cross.	Alluding, probably, to a mode of eliciting truth by torture.
1380	Experto crede Roberto.	proverb			Believe Robert, who speaks from experience.	A proverb commonly used in the middle ages; but its origin does not appear to be known. Burton uses it in the Introduction to his Anatomy of Melancholy.
1381	Experto crede.		Virgil		Believe one who speaks from experience.	
1382	Expertus metuit.		Horace		He who has experienced it, dreads it.	
1383	Expetuntur divitiae ad perficiendas voluptates.		Cicero		Riches are sought to minister to our pleasures.	
1384	Explorant adversa viros; perque aspera duro Nititur ad laudem virtus interrita clivo.		Silius Italicus		Adversity proves men; and virtue, undaunted, struggles through difficulties, and up the steep height, to gain the reward of fame.	
1385	Expressa nocent, non expressa non nocent.	legal maxim			What is expressed may be injurious, what is not expressed is not so.	Said in reference to written contracts.
1386	Expressio unius est exclusio alterius.	legal maxim			The naming of one man implies the exclusion of another.	
1387	Extinctus amabitur idem.		Horace		The same man will be beloved when dead.	Men, in general, meet with more justice from their fellow-men, when dead, than when alive.
1388	Extra lutum pedes habes.	proverb			You have got your feet out of the mud.	You are well out of that difficulty.
1389	Extra telorum jactum.				Beyond bow-shot.	Out of harm's way. See Ego post, &c.
1390	Extrema gaudii luctus occupat.	proverb			Grief borders on the extremes of gladness.	"If you laugh to-day, you may cry to-morrow," is an old saying.
1391	Extrema manus nondum operibus ejus imposita est.				The finishing hand has not yet been put to his work.	
1392	Extremis digitis attingere.				To touch with the finger ends.	To handle a matter lightly.
1393	Extremis malis extrema remedia.	proverb			Extreme evils require extreme remedies.	Desperate maladies require desperate remedies.
1394	Exuerint sylvestrem animum, cultuque frequenti, In quascunque voces artes, haud tarda sequentur.		Virgil		They lay aside their rustic nature, and by repeated instruction will advance apace in any arts into which you may initiate them.	
1395	Exul, inops erres, alienaque limina lustres; Exiguumque petas ore tremente cibum.		Ovid		An exile, and in need, mayst thou wander, and mayst thou survey the thresholds of others, and beg with tremulous lips a morsel of food.	
1396	F. C.					See Fieri curavit.
1397	Fabas indulcet fames.	proverb			Hunger sweetens beans.	Hunger is the best sauce.
1398	Faber compedes quas fecit ipse Gestet.		Ausonius		Let the blacksmith wear the fetters which he himself has forged.	See Tute hoc, &c.
1399	Faber quisque fortunae suae.		Sallust		Every man is the architect of his own fortune.	
1400	Fabricando fabri fimus.	proverb			By working we become workmen.	Practice makes perfect.
1401	Fabula, nec sentis, tota jactaris in urbe.		Ovid		You are the talk, and yet you do not perceive it, of the whole city.	
1402	Fac simile.				Do the like.	Read as one word, it means an exact imitation or copy of anything.
1403	Fac totum.				Do everything.	Hence our word factotum, meaning a "handy man."
1404	Facetiarum apud praepotentes in longum memoria est.		Tacitus		Men in power do not readily forget a joke.	
1405	Faciam ut hujus loci semper memineris.		Terence		I will make you always remember this place.	
1406	Facies non omnibus una, Nec diversa tamen, qualis decet esse sororum.		Ovid		The features are not the same in all, nor yet very different; they are such as those of sisters ought to be.	A description of "a family likeness."
1407	Facies tua computat annos.				Your face reckons your years;	or, "Your face tells your age."
1408	Facile est imperium in bonis.		Plautus		The sway is easy over the good.	
1409	Facile est inventis addere.	proverb			It is easy to improve what has been already invented.	
1410	Facile improbi malitia sua aspergunt probos.				Wicked men with their malice easily asperse the characters of the good.	
1411	Facile invenies et pejorem, et pejus moratam, Meliorem neque tu reperies, neque sol videt.		Plautus		You may easily find a worse woman, and one of worse manners; a better one you will not find, nor does the sun behold such.	
1412	Facile omnes cum valenus recta consilia Aegrotis damus. Tu, si hic sis, aliter senties.		Terence		When we are in health, we are all able to give good advice to the sick. You, if you were in my place, would think otherwise.	
1413	Facile princeps.				The acknowledged chief.	The one who stands first, beyond a doubt.
1414	Facilius crescit quam inchoatur dignitas.		Publilius Syrus		Increase of dignity is more easily gained than the first step.	
1415	Facilius sit Nili caput invenire.	proverb			It would be easier to discover the sources of the Nile.	
1416	Facinus audax incipit, Qui cum opulento pauper homine coepit rem habere aut negotium.		Plautus		A pooir man who commences to have business or dealings with an opulent one, commences upon a rash undertaking.	
1417	Facinus majoris abollae.		Juvenal		The crime of a more dignified garb.	A crime committed by a philosopher of more dignified character. The abolla was the cloak worn by philosophers.
1418	Facinus quos inquinat aequat.		Lucan		Those whom guilt defiles, it places on a level.	The highest and the lowest are equally degraded by guilt; but, if anything, the former is the most culpable.
1419	Facit gratum fortuna, quam nemo videt.		Publilius Syrus		The good fortune which no one sees, makes a man grateful for it.	Because he is not the object of envy.
1420	Facito aliquid operis, ut semper te diabolus inveniat occupatum.		Jerome		Be busy about something; so that the devil may always find you occupied.	
1421	Faciunt nae intelligendo, ut nihil intelligant?		Terence		By being thus knowing, do they not show that they know nothing at all?	
1422	Facllis descensus Averni, Sed revocare gradum, superasque evadere ad auras, Hic labor, hoc opus est.		Virgil		Easy the descent to hell; but to retrace your steps and to regain the upper world, that is the difficulty, that the labour.	The poet alludes to the descent of Aeneas to the Infernal regions; but the figure may be applied to the readiness with which we may fall into evil courses, and the difficulty of retracing our steps.
1423	Facta canam; sed erunt qui me finxisse loquantur.		Ovid		I shall sing of facts; but there will be some to say that I have invented fictions.	
1424	Factis ignoscite nostris, Si scelus ingenio scitis abesse meo.		Ovid		Forgive my deeds, inasmuch as ye know that impiety was far from my intention.	
1425	Facto pius et sceleratus eodem.		Ovid		A father, affectionate and unnatural in the self-same act.	Said of Agenor, when he dismissed his son Cadmus to roam over the world in search of his daughter Europa.
1426	Factum abiit; monumenta manent.		Ovid		The occurrence has passed away; the memorial of it still remains.	The motto of the London Numismatic Society.
1427	Factum est illud; fieri infectum non potest.		Plautus		The thing is done, it cannot be undone.	
1428	Faex populi.				The dregs of the people.	The scum of the population.
